pat_id, title, USPA#, date
pat1_795, Near-infrared reflecting  ultraviolet protected  safety protected  electrochromic vehicular glazing, 5239406, August 24  1993, 
pat1_796, Solar driven novelty device, 5237764, August 24  1993, 
pat1_797, Fairing and utility assembly for bicycles, 5222752, June 29  1993, 
pat1_798, Solar battery module, 5217540, June 8  1993, 
pat1_799, Solar powered light, 5217296, June 8  1993, 
pat1_79, Solar umbrella clip light, 8317355, November 27  2012, 
pat1_7, Terrestrial solar power system using III-V semiconductor solar cells, 8513518, August 20  2013, 
pat1_800, Energy efficient skylight and blind, 5204777, April 20  1993, 
pat1_801, Solar collector, 5195503, March 23  1993, 
pat1_802, Solar radon reduction, 5186160, February 16  1993, 
pat1_803, Generic solar cell array using a printed circuit substrate, 5185042, February 9  1993, 
pat1_804, Helicopter installable  self-powered  modular  remote  telemetry package, 5184502, February 9  1993, 
pat1_805, Lightning detecting and recording system, 5184215, February 2  1993, 
pat1_806, Two-axis tracking solar collector mechanism, 5169456, December 8  1992, 
pat1_807, Solar panel, 5164020, November 17  1992, 
pat1_808, High resolution telescope, 5159489, October 27  1992, 
pat1_809, Water sprinkling lounge chair apparatus, 5156339, October 20  1992, 
pat1_80, Protective covering for roof mounted systems, 8316592, November 27  2012, 
pat1_810, Thin film coating and method, 5154810, October 13  1992, 
pat1_811, Solar radiation sensor housing with slanted photodetector and knurled filter, 5153429, October 6  1992, 
pat1_812, Method and device for removing space debris, 5153407, October 6  1992, 
pat1_813, Modular mother satellite bus for subsidiary payloads, 5152482, October 6  1992, 
pat1_814, Thermal control apparatus for satellites and other spacecraft, 5148860, September 22  1992, 
pat1_815, Automatic solar-powered car ventilator, 5148736, September 22  1992, 
pat1_816, Deer repelling apparatus, 5148621, September 22  1992, 
pat1_817, Device for evaporatie cooling of the neck, 5146765, September 15  1992, 
pat1_818, Support for photovoltaic arrays, 5143556, September 1  1992, 
pat1_819, Passive solar heating apparatus, 5143051, September 1  1992, 
pat1_81, Measurement method of the current-voltage characteristics of photovoltaic device  a solar simulator for the measurement  and a module for setting irradiance and a part for adjusting irradiance used for the solar simulator, 8315848, November 20  2012, 
pat1_820, Heat pump system, 5129236, July 14  1992, 
pat1_821, Solar powered cooling apparatus for a vehicle brake system, 5121818, June 16  1992, 
pat1_822, Self contained solar powered strobe light, 5121307, June 9  1992, 
pat1_823, Terrestrial concentrator solar cell module, 5118361, June 2  1992, 
pat1_824, Condenser coil cooling apparatus, 5117644, June 2  1992, 
pat1_825, Portable solar heating device and heating process utilizing solar energy, 5113845, May 19  1992, 
pat1_826, Portable water purification device, 5106495, April 21  1992, 
pat1_827, Solar powered swimming pool skimmer, 5106492, April 21  1992, 
pat1_828, Multipurpose combination leveling tool, 5103569, April 14  1992, 
pat1_829, Ice fishing alarm, 5101591, April 7  1992, 
pat1_82, Landscaping wall and mounting system and methods, 8313267, November 20  2012, 
pat1_830, Panel for solar concentrators and tandem cell units, 5096505, March 17  1992, 
pat1_831, Wall elements, 5092101, March 3  1992, 
pat1_832, Method for applying an organic insulator to a solar array, 5086003, February 4  1992, 
pat1_833, Automatic retractable shade, RE33804, January 28  1992, 
pat1_834, Vehicle vent, 5081912, January 21  1992, 
pat1_835, Automatic retractable shade mounting case, 5078194, January 7  1992, 
pat1_836, Solar roof vent, 5078047, January 7  1992, 
pat1_837, Solar powered trolling motor, 5074811, December 24  1991, 
pat1_838, Solar powered navigation buoy generator, 5066338, November 19  1991, 
pat1_839, Sunscreen for motor vehicles, 5064239, November 12  1991, 
pat1_83, Solar panel overlay and solar panel overlay assembly, 8309840, November 13  2012, 
pat1_840, Solar heating drapery opening indcator, 5063984, November 12  1991, 
pat1_841, Solar concentrator device and support structure therefor, 5058565, October 22  1991, 
pat1_842, Solar rechargeable light, 5055984, October 8  1991, 
pat1_843, Electrostatic spray gun, 5044564, September 3  1991, 
pat1_844, Solar cell device, 5043024, August 27  1991, 
pat1_845, Control circuit for a solar-powered rechargeable power source and load, 5041952, August 20  1991, 
pat1_846, Proximity light, 5036443, July 30  1991, 
pat1_847, Apparatus for cultivating aquatic living things in sea water, 5027550, July 2  1991, 
pat1_848, Mail arrival signal system, 5023595, June 11  1991, 
pat1_849, Solar ray device for illumination, 5022736, June 11  1991, 
pat1_84, Mounting device for disk-shaped substrates such as solar wafers, 8307997, November 13  2012, 
pat1_850, Barrel-shaped solar roofing element and method for its assembly, 5022381, June 11  1991, 
pat1_851, Solar cell interconnection and packaging using tape carrier, 5021099, June 4  1991, 
pat1_852, Heat flow sensing apparatus and method, 5020919, June 4  1991, 
pat1_853, Aquatic transducer system, 5012457, April 30  1991, 
pat1_854, Accordion mount for solar cells including point-of-purchase display with leds, 5012160, April 30  1991, 
pat1_855, Solar panel with interconnects and masking structure  and method, 5011544, April 30  1991, 
pat1_856, Solar energy intensifier and collector system, 5010873, April 30  1991, 
pat1_857, Personal UV radiometer, 5008548, April 16  1991, 
pat1_858, Solar electric drying apparatus, 5001846, March 26  1991, 
pat1_859, Screen assembly, 4999948, March 19  1991, 
pat1_85, Device and method for solar power generation, 8304644, November 6  2012, 
pat1_860, Universal solar concentrator panel, 4999059, March 12  1991, 
pat1_861, Light radiation stand, 4995712, February 26  1991, 
pat1_862, Dual axis solar collector assembly, 4995377, February 26  1991, 
pat1_863, Device for protection from the sun, 4993469, February 19  1991, 
pat1_864, Tanning pod, 4989600, February 5  1991, 
pat1_865, Semiconductor device  manufacturing method  and system, 4988642, January 29  1991, 
pat1_866, Solar collector panel arrangement with partly and fully foldable panels, 4988060, January 29  1991, 
pat1_867, Thermal insulating shade, 4986343, January 22  1991, 
pat1_868, Atmospheric pressure power plant, 4981014, January 1  1991, 
pat1_869, Fishing apparatus, 4980986, January 1  1991, 
pat1_86, Parabolic trough or dish reflector for use in concentrating solar power apparatus and method of making same, 8303124, November 6  2012, 
pat1_870, Solar ray collecting device, 4979492, December 25  1990, 
pat1_871, Apparatus for welding components together with the use of ultrasound, 4975133, December 4  1990, 
pat1_872, Solar aircraft detector, 4974934, December 4  1990, 
pat1_873, Automobile solar powered utility light, 4974129, November 27  1990, 
pat1_874, Solar heat collector and insulation panel construction, 4971028, November 20  1990, 
pat1_875, Light transmitting glazing pane, 4968563, November 6  1990, 
pat1_876, Two-axis tracking solar collector mechanism, 4968355, November 6  1990, 
pat1_877, Support for photovoltaic arrays, 4966631, October 30  1990, 
pat1_878, Spacecraft structure for orbital assembly and servicing, 4964596, October 23  1990, 
pat1_879, Method for the reproducable formation of material layers and/or the treatment of semiconductor materials layers, 4962461, October 9  1990, 
pat1_87, Four-sided photography camera, 8300099, October 30  2012, 
pat1_880, Rainbow forming device, 4955975, September 11  1990, 
pat1_881, Air conditioner for parked automotive vehicle, 4955203, September 11  1990, 
pat1_882, Barrel-shaped solar roofing element and method for its manufacture, 4953537, September 4  1990, 
pat1_883, Window blind system, 4951730, August 28  1990, 
pat1_884, Solar ray collecting device, 4943141, July 24  1990, 
pat1_885, Vehicular internal air exhausting device, 4942806, July 24  1990, 
pat1_886, Multispectral glancing incidence X-ray telescope, 4941163, July 10  1990, 
pat1_887, Combination portable cooler with audio receiver and portable cooler with audio system, 4939912, July 10  1990, 
pat1_888, Heat engine based on shape memory alloys, 4938026, July 3  1990, 
pat1_889, Solar energy system, 4936290, June 26  1990, 
pat1_88, Solar collector, 8297274, October 30  2012, 
pat1_890, Multi-lever rim-drive heliostat, 4930493, June 5  1990, 
pat1_891, Container for accommodating a solar ray-collecting device, 4928666, May 29  1990, 
pat1_892, Outdoor toilet holding tank ventilation system, 4922557, May 8  1990, 
pat1_893, Baseboard for orthogonal chip mount, 4922378, May 1  1990, 
pat1_894, Container for accommodating a solar ray-collecting device, 4915093, April 10  1990, 
pat1_895, Light ray radiation stand, 4911511, March 27  1990, 
pat1_896, Solar collector having absorber plate formed by spraying molten metal, 4911353, March 27  1990, 
pat1_897, Swimming pool safety alarm, 4910498, March 20  1990, 
pat1_898, Marine transponder system, 4903243, February 20  1990, 
pat1_899, Solar powered ventilator, 4899645, February 13  1990, 
pat1_89, High-efficiency thin-film solar cells, 8294026, October 23  2012, 
pat1_8, Solar support structure, 8511007, August 20  2013, 
pat1_900, Deep well solar pump, 4898519, February 6  1990, 
pat1_901, Engine starter having planet reduction gear mechanism, 4891996, January 9  1990, 
pat1_902, Stand for a solar ray collecting device, 4890806, January 2  1990, 
pat1_903, Solar panel mounting assembly, 4890599, January 2  1990, 
pat1_904, Self contained collision avoidance light, 4890091, December 26  1989, 
pat1_905, Device for indicating hydroculture-related values, 4878043, October 31  1989, 
pat1_906, Support and maneuvering apparatus for solar energy receivers, 4875467, October 24  1989, 
pat1_907, Beam construction, 4875311, October 24  1989, 
pat1_908, Preheater for clothes dryer, 4875298, October 24  1989, 
pat1_909, Plant spinner, 4873790, October 17  1989, 
pat1_90, Barcode scanner, 8292184, October 23  2012, 
pat1_910, Combination table top football and hockey game, 4872679, October 10  1989, 
pat1_911, Temperature measurement apparatus for use in recreational and sporting activities, 4864763, September 12  1989, 
pat1_912, Two-dimensional piezoelectric transducer assembly, 4864179, September 5  1989, 
pat1_913, Integrated smoke and intrusion alarm system, 4862141, August 29  1989, 
pat1_914, Solar oven, 4848320, July 18  1989, 
pat1_915, Light rays radiation device for medical treatment, 4844069, July 4  1989, 
pat1_916, Mat with sound system, 4841587, June 27  1989, 
pat1_917, Portable misting fan, 4839106, June 13  1989, 
pat1_918, Automatic flow-control device, 4839039, June 13  1989, 
pat1_919, Solar module mounting arrangement using angle brackets, 4838951, June 13  1989, 
pat1_91, Backpack having a load compensating strap arrangement, 8281970, October 9  2012, 
pat1_920, Liquid-cooled sealed enclosure for concentrator solar cell and secondary lens, 4830678, May 16  1989, 
pat1_921, Outer glass pipes for solar heat collector pipes, 4827905, May 9  1989, 
pat1_922, Portable solar charged operated lamp having orientation switch for selectively energizing lamp based upon its physical orientation, 4823241, April 18  1989, 
pat1_923, Variable solar control window assembly, 4813198, March 21  1989, 
pat1_924, Bird feeder with scale, 4811694, March 14  1989, 
pat1_925, System for rating electric power transmission lines and equipment, 4806855, February 21  1989, 
pat1_926, Solar-energy collector, 4803972, February 14  1989, 
pat1_927, Solar ray energy radiating device for use in medical treatment, 4794925, January 3  1989, 
pat1_928, Motor-driven map holder, 4794715, January 3  1989, 
pat1_929, Solar cell powered clock having a decorative pendulum, 4791621, December 13  1988, 
pat1_92, Method and apparatus for arranging a solar cell and reflector, 8281782, October 9  2012, 
pat1_930, Removable protective vehicle windshield screen, 4790591, December 13  1988, 
pat1_931, Optical conductor cable supporting stand for a light ray radiation device used in medical treatment, 4790500, December 13  1988, 
pat1_932, Solar collector, 4789408, December 6  1988, 
pat1_933, Thermal insulating shades, 4784215, November 15  1988, 
pat1_934, Gate opening apparatus, 4782628, November 8  1988, 
pat1_935, Water temperature measurement apparatus, 4782617, November 8  1988, 
pat1_936, Ice fishing device, 4780979, November 1  1988, 
pat1_937, Automatic retractable shade, 4775180, October 4  1988, 
pat1_938, Support and maneuvering device, 4762298, August 9  1988, 
pat1_939, Auxiliary equipment for the thermostatic valve of a radiator, 4760954, August 2  1988, 
pat1_93, Environmental power generation device and associated methods, 8278868, October 2  2012, 
pat1_940, Solar heater for mounting on a boat, 4757803, July 19  1988, 
pat1_941, Reflector antenna and method of fabrication, 4755819, July 5  1988, 
pat1_942, Retrofittable insulating system for solar rooms, 4744403, May 17  1988, 
pat1_943, Solar collector storage system and method, 4739748, April 26  1988, 
pat1_944, Emergency warning signal, 4736186, April 5  1988, 
pat1_945, Solid state heat to electricity converter, 4733121, March 22  1988, 
pat1_946, Inflatable core orbital construction method and space station, 4730797, March 15  1988, 
pat1_947, Apparatus for automatically directing solar radiation focused by a reflector, 4730602, March 15  1988, 
pat1_948, Compact attic mounted solar heating pack assembly, RE32607, February 23  1988, 
pat1_949, Daylamp system, 4720170, January 19  1988, 
pat1_94, Integrated mounting pole system for communication and surveillance infrastructures, 8276322, October 2  2012, 
pat1_950, Light transmissive insulation apparatus, 4719902, January 19  1988, 
pat1_951, Modular solar generating system, 4718185, January 12  1988, 
pat1_952, Solar system simulator, 4713011, December 15  1987, 
pat1_953, Solar collector assembly and kit, 4706650, November 17  1987, 
pat1_954, Solar cooker, 4696285, September 29  1987, 
pat1_955, Energy conversion system, 4691075, September 1  1987, 
pat1_956, Geostationary communications satellite, 4690354, September 1  1987, 
pat1_957, Electronic equipment having a key input function, 4681987, July 21  1987, 
pat1_958, Solar powered headwear fan, 4680815, July 21  1987, 
pat1_959, Odometer for golf cart, 4680454, July 14  1987, 
pat1_95, Solar panel array sun tracking system, 8273978, September 25  2012, 
pat1_960, Method for producing a carrier material for the solar cells of a solar generator, 4680074, July 14  1987, 
pat1_961, Protective shield for a welders mask, 4679254, July 14  1987, 
pat1_962, Apparatus for mounting solar cells, 4677248, June 30  1987, 
pat1_963, Solar radiation collector, 4672948, June 16  1987, 
pat1_964, Artificial larynx, 4672673, June 9  1987, 
pat1_965, Semiconductor packaging and method, 4672421, June 9  1987, 
pat1_966, Solar generator mounting structure, 4668841, May 26  1987, 
pat1_967, Transparent photovoltaic module, 4663495, May 5  1987, 
pat1_968, Surface analyzer and method, 4659933, April 21  1987, 
pat1_969, Method and apparatus for improved aquaculture/mariculture, 4658757, April 21  1987, 
pat1_96, Roofing grommet forming a seal between a roof-mounted structure and a roof, 8272174, September 25  2012, 
pat1_970, Spacecraft to shuttle docking method and apparatus, 4657211, April 14  1987, 
pat1_971, Solar heat regulator, 4655195, April 7  1987, 
pat1_972, Apparatus for plant culture, 4653223, March 31  1987, 
pat1_973, Solar system, 4644933, February 24  1987, 
pat1_974, Solar panel module and support therefor, 4636577, January 13  1987, 
pat1_975, Solar control film, 4634637, January 6  1987, 
pat1_976, Solar ray collecting device for use in a spacecraft, 4634086, January 6  1987, 
pat1_977, Electric fishing reel, 4634072, January 6  1987, 
pat1_978, Modular ventilation system for vehicles, 4633767, January 6  1987, 
pat1_979, Buoy lantern system, 4626852, December 2  1986, 
pat1_97, Wafer level interconnection of inverted metamorphic multijunction solar cells, 8263853, September 11  2012, 
pat1_980, Solar collector assembly and kit, 4622951, November 18  1986, 
pat1_981, Annular solar panel, 4621616, November 11  1986, 
pat1_982, Solar heating and cooling diode module, 4615381, October 7  1986, 
pat1_983, Solar heat collector arrangement, 4615329, October 7  1986, 
pat1_984, Apparatus for controlling the directional orientation of a radiation receiver device to a light source, 4612488, September 16  1986, 
pat1_985, Solar wall panel, 4602615, July 29  1986, 
pat1_986, Interconnector attachment machine, 4602417, July 29  1986, 
pat1_987, Interiorly tensioned solar reflector, 4596238, June 24  1986, 
pat1_988, Light-bulb attached sign assembly, 4596083, June 24  1986, 
pat1_989, Solar generator mounting structure, 4594470, June 10  1986, 
pat1_98, Rack assembly for mounting solar modules, 8256170, September 4  2012, 
pat1_990, Solar powered vehicle, 4592436, June 3  1986, 
pat1_991, Focussing solar collector, 4590920, May 27  1986, 
pat1_992, Solar ray collecting device, 4589400, May 20  1986, 
pat1_993, Method of making solar heater, 4589186, May 20  1986, 
pat1_994, Well pumping unit, 4586879, May 6  1986, 
pat1_995, Reflective solar tracking system, 4586488, May 6  1986, 
pat1_996, Tracking device, 4585318, April 29  1986, 
pat1_997, Hemispheric solar panel, 4577620, March 25  1986, 
pat1_998, Light distribution and collection assemblies and methods, 4576436, March 18  1986, 
pat1_999, Ternary III-V multicolor solar cells containing a quaternary window layer and a quaternary transition layer, 4575577, March 11  1986, 
pat1_99, Antenna system for communications on-the-move, 8248318, August 21  2012, 
pat1_9, Building-integrated solar-panel roof element systems, 8511006, August 20  2013, 
pat2_100, Portable power and utility system, 8013567, September 6  2011, 
pat2_101, Resin bonded sorbent, 7989388, August 2  2011, 
pat2_102, Lead frame thermoplastic solar cell receiver, 7977777, July 12  2011, 
pat2_103, Solar powered rechargeable street light with tamper resistant networkable system, 7976180, July 12  2011, 
pat2_104, Integrated mounting system for communication and surveillance infrastructures, 7974079, July 5  2011, 
pat2_105, Photovoltaic solar panel mounting system, 7971398, July 5  2011, 
pat2_106, Solar energy collection system, 7968791, June 28  2011, 
pat2_107, Decorative reflective spinning device, 7954264, June 7  2011, 
pat2_108, Systems  methods  and apparatuses for stray voltage detection, 7944365, May 17  2011, 
pat2_109, Photovoltaic module connector assembly, 7938661, May 10  2011, 
pat2_10, Flat light concentration device with reduced thickness, 8497422, July 30  2013, 
pat2_110, Connection and junction box for a solar module, 7931488, April 26  2011, 
pat2_111, Formation of stretchable photovoltaic devices and carriers, 7923282, April 12  2011, 
pat2_112, Solar powered internally illuminated billboard, 7912590, March 22  2011, 
pat2_113, Extra electric energy for day-night cycle solar aircraft, 7898789, March 1  2011, 
pat2_114, Modular shade system with solar tracking panels, 7888587, February 15  2011, 
pat2_115, Solar powered irrigation machine, 7878429, February 1  2011, 
pat2_116, Planar solar concentrator power module, 7872192, January 18  2011, 
pat2_117, Continuous circuit overlay solar shingles, 7858874, December 28  2010, 
pat2_118, Passively cooled solar concentrating photovoltaic device, 7851693, December 14  2010, 
pat2_119, Modular electric powertrain for a vehicle, 7849945, December 14  2010, 
pat2_11, Mounting rail and power distribution system for use in a photovoltaic system, 8469735, June 25  2013, 
pat2_120, Multi-mode rain sensor, 7847255, December 7  2010, 
pat2_121, Unitized building integrated photovoltaic conversion module, 7845128, December 7  2010, 
pat2_122, Method for determining the position of a first moving component relative to a second component and device for applying said method, 7842913, November 30  2010, 
pat2_123, Systems and methods for remotely controlling an electrical load, 7839017, November 23  2010, 
pat2_124, Junction box for photovoltaic modules, 7824189, November 2  2010, 
pat2_125, Modular shade system, 7807918, October 5  2010, 
pat2_126, Solar tracker, 7799987, September 21  2010, 
pat2_127, Ventilated photovoltaic module frame, 7774998, August 17  2010, 
pat2_128, System for mounting a photovoltaic module to a surface, 7766292, August 3  2010, 
pat2_129, Pendulum actuated automatic leveler, 7752764, July 13  2010, 
pat2_12, System and method for utility pole distributed solar power generation, 8466581, June 18  2013, 
pat2_130, Integrated photoelectrochemical cell and system having a liquid electrolyte, 7750234, July 6  2010, 
pat2_131, Method of producing solar cell module, 7749351, July 6  2010, 
pat2_132, Method of manufacturing and installing a low profile mounting system, 7748175, July 6  2010, 
pat2_133, Constant force mechanical scribers and methods for using same in semiconductor processing applications, 7707732, May 4  2010, 
pat2_134, Shape memory alloy motor as incorporated into solar tracking mechanism, 7692091, April 6  2010, 
pat2_135, Rigid integrated photovoltaic roofing membrane and related methods of manufacturing same, 7678991, March 16  2010, 
pat2_136, Renewable energy system for electric vehicles, 7665553, February 23  2010, 
pat2_137, High efficiency solar powered fan, 7662035, February 16  2010, 
pat2_138, Inline inspection of photovoltaics for electrical defects, 7649365, January 19  2010, 
pat2_139, Electrical connector arrangement for knife contacts, 7648371, January 19  2010, 
pat2_13, Next generation photovoltaic solar panel piggyback mounting system, 8464478, June 18  2013, 
pat2_140, Revolutionary solar collecting system, 7640931, January 5  2010, 
pat2_141, Laminated solar concentrating photovoltaic device, 7638708, December 29  2009, 
pat2_142, Solar memorial marker, 7635196, December 22  2009, 
pat2_143, Electrical connecting apparatus for flat conductors, 7632109, December 15  2009, 
pat2_144, Photovoltaic concentrator modules and systems having a heat dissipating element located within a volume in which light rays converge from an optical concentrating element towards a photovoltaic receiver, 7622666, November 24  2009, 
pat2_145, Wind driven venturi turbine, 7615883, November 10  2009, 
pat2_146, Low profile mounting system, 7600349, October 13  2009, 
pat2_147, Method and apparatus for mounting photovoltaic modules, 7592537, September 22  2009, 
pat2_148, Communication system providing hybrid optical/wireless communications and related methods, 7583642, September 1  2009, 
pat2_149, Apparatus for mounting photovoltaic power generating systems on buildings, 7574842, August 18  2009, 
pat2_14, Optical sensor for medical device, 8463343, June 11  2013, 
pat2_150, Automated leveling apparatus, 7568291, August 4  2009, 
pat2_151, Modular shade system with solar tracking panels, 7557292, July 7  2009, 
pat2_152, Photovoltaic module with adjustable heat sink and method of fabrication, 7557290, July 7  2009, 
pat2_153, Tracking solar shelter, 7531741, May 12  2009, 
pat2_154, Method and apparatus for mounting an array of solar collectors, 7484507, February 3  2009, 
pat2_155, Rechargeable electronic device system and method for recharging an electronic device, 7471060, December 30  2008, 
pat2_156, Apparatus and method for mounting photovoltaic power generating systems on buildings, 7435897, October 14  2008, 
pat2_157, Photovoltaic module mounting clip with integral grounding, 7435134, October 14  2008, 
pat2_158, System for removably and adjustably mounting a device on a surface, 7434362, October 14  2008, 
pat2_159, Battery-operated wireless-communication apparatus and method, 7433655, October 7  2008, 
pat2_15, Quartz boat method and apparatus for thin film thermal treatment, 8461061, June 11  2013, 
pat2_160, Dock light, 7425086, September 16  2008, 
pat2_161, Photovoltaically powered cathodic protection system for automotive vehicle, 7422666, September 9  2008, 
pat2_162, Inverter design, 7397653, July 8  2008, 
pat2_163, Terrestrial solar array, 7381886, June 3  2008, 
pat2_164, Method and system for mounting photovoltaic material, 7365266, April 29  2008, 
pat2_165, Owner aware objects, 7336173, February 26  2008, 
pat2_166, Method and system for vision enhancement, 7334892, February 26  2008, 
pat2_167, Photovoltaic array, 7307209, December 11  2007, 
pat2_168, Ventilated photovoltaic module frame, 7297866, November 20  2007, 
pat2_169, Compact micro-concentrator for photovoltaic cells, 7297865, November 20  2007, 
pat2_16, Solar light apparatus and system, 8459826, June 11  2013, 
pat2_170, Apparatus and method for positioning a module on an object, 7260918, August 28  2007, 
pat2_171, Personal renewable-energy fueling and storage station for electric-powered vehicles, 7248018, July 24  2007, 
pat2_172, Photovoltaic powered multimedia greeting cards and smart cards, 7205473, April 17  2007, 
pat2_173, Bicycle with optional power assist, 7185726, March 6  2007, 
pat2_174, Shingle assembly with support bracket, 7155870, January 2  2007, 
pat2_175, Solar powered rainbow maker, 7153022, December 26  2006, 
pat2_176, Food cooking container with monitoring means for monitoring the operating temperature thereof, 7112765, September 26  2006, 
pat2_177, Power assisted recumbent bicycle and power unit, 7108097, September 19  2006, 
pat2_178, Intraocular implants, 7001427, February 21  2006, 
pat2_179, Medicament dispenser, 6981499, January 3  2006, 
