pat_id, title, USPA#, date
pat1_1260, Solar collector assembly, 4221208, September 9  1980, 
pat1_1261, Solar food dryer, 4221059, September 9  1980, 
pat1_1262, Liquid solar heat collector, 4217888, August 19  1980, 
pat1_1263, Collection and utilization of solar energy, 4217884, August 19  1980, 
pat1_1264, Solar collector panel assembly, 4215677, August 5  1980, 
pat1_1265, Solar tracker, 4215410, July 29  1980, 
pat1_1266, Air distribution control system, 4213447, July 22  1980, 
pat1_1267, Solar shutter or blind system for windows, 4212289, July 15  1980, 
pat1_1268, Apparatus for desalinating water, 4211609, July 8  1980, 
pat1_1269, Multimode solar energy collector and process, 4210463, July 1  1980, 
pat1_126, Grid support system for a tracker-mounted solar panel array for rooftop applications, 8188414, May 29  2012, 
pat1_1270, Energy conversion apparatus, 4210122, July 1  1980, 
pat1_1271, Mounting for solar cell, 4209347, June 24  1980, 
pat1_1272, Solar energy recharger, 4209346, June 24  1980, 
pat1_1273, Solar central receiver heliostat reflector assembly, 4209236, June 24  1980, 
pat1_1274, Solar energy collector, 4205659, June 3  1980, 
pat1_1275, Heat transfer panel, 4205658, June 3  1980, 
pat1_1276, Convertible modular tri-mode solar conversion system, 4205657, June 3  1980, 
pat1_1277, Mount for solar collectors, 4204523, May 27  1980, 
pat1_1278, Solar heating system and component, 4203422, May 20  1980, 
pat1_1279, Solar energy collector and heat exchanger, 4202322, May 13  1980, 
pat1_127, Method and apparatus for solar energy collection, 8183457, May 22  2012, 
pat1_1280, Solar energy collector assembly, 4202320, May 13  1980, 
pat1_1281, Building roof with solar collector, 4202319, May 13  1980, 
pat1_1282, Solar heat collector with channeled panel, 4201194, May 6  1980, 
pat1_1283, Solar energy collector assembly and sub-assemblies thereof, 4201190, May 6  1980, 
pat1_1284, Solar energy collector and associated methods adapted for use with overlapped roof shingles on the roof of a building, 4197834, April 15  1980, 
pat1_1285, Energy conservation, 4196718, April 8  1980, 
pat1_1287, Large area parabolic concentrating solar collector, 4195620, April 1  1980, 
pat1_1288, Method and apparatus for installing solar collector panels, 4194497, March 25  1980, 
pat1_1289, Self-sealing solar collector shield, 4194334, March 25  1980, 
pat1_128, Roofing system and method, 8181398, May 22  2012, 
pat1_1290, Solar energy collector, 4186722, February 5  1980, 
pat1_1291, Solar collector structure, 4185615, January 29  1980, 
pat1_1292, Solar beacon, 4183622, January 15  1980, 
pat1_1293, Solar powered electric toy top, 4182077, January 8  1980, 
pat1_1294, Concentrator solar cell array module, 4180414, December 25  1979, 
pat1_1295, Magnetic wheel drive, 4179633, December 18  1979, 
pat1_1296, Solar collector and system for mounting a plurality of solar collectors on a surface, 4178910, December 18  1979, 
pat1_1297, Solar energy teaching aid, 4178699, December 18  1979, 
pat1_1298, Adsorption air conditioner, 4176523, December 4  1979, 
pat1_1299, Solar heat roofing system, 4174703, November 20  1979, 
pat1_129, Vertical aquaponic micro farm, 8181391, May 22  2012, 
pat1_12, Junction box for a photovoltaic solar panel, 8500462, August 6  2013, 
pat1_1300, Therapeutic adornments utilizing solar cells, 4173229, November 6  1979, 
pat1_1301, Solar energy system, 4172740, October 30  1979, 
pat1_1302, Sun tracker with dual axis support for diurnal movement and seasonal adjustment, 4172739, October 30  1979, 
pat1_1303, Central receiver solar collector using analog coupling mirror control, 4172443, October 30  1979, 
pat1_1304, Solar energy collector, 4170985, October 16  1979, 
pat1_1305, Memorial audio reproduction system, 4169970, October 2  1979, 
pat1_1306, Magnetic torque multiplier, 4167684, September 11  1979, 
pat1_1307, Solar cell module, 4167644, September 11  1979, 
pat1_1308, Solar collector, 4166446, September 4  1979, 
pat1_1309, Adjustable optical filter, 4165919, August 28  1979, 
pat1_130, Mounting assembly for arrays and other surface-mounted equipment, 8177180, May 15  2012, 
pat1_1310, Mounting bracket for solar heat collector, 4165853, August 28  1979, 
pat1_1311, Elliptical solar reflector, 4164934, August 21  1979, 
pat1_1312, Self-powered electrical meter for display of a liquid-level or the like measurement, 4164145, August 14  1979, 
pat1_1313, Roofing panels, 4163445, August 7  1979, 
pat1_1314, Air-to-air heat pump, 4163369, August 7  1979, 
pat1_1315, Focussing flat plate solar collector device, 4161169, July 17  1979, 
pat1_1316, Solar energy conversion unit, 4159712, July 3  1979, 
pat1_1317, Solar radiation collector and concentrator, RE30027, June 12  1979, 
pat1_1318, Solar energy collector, 4155346, May 22  1979, 
pat1_1319, Prismatic solar reflector apparatus and method of solar tracking, 4154219, May 15  1979, 
pat1_131, Photovoltaic mounting system with locking connectors  adjustable rail height and hinge lock, 8176693, May 15  2012, 
pat1_1320, Solar collector, 4153042, May 8  1979, 
pat1_1321, Focusing solar energy apparatus, 4153039, May 8  1979, 
pat1_1322, Photoelectric cell using an improved photoelectric plate and plate array, 4152174, May 1  1979, 
pat1_1323, Solar energy collector and concentrator, 4150663, April 24  1979, 
pat1_1324, Solar energy collection system, 4149521, April 17  1979, 
pat1_1325, Passive sealed flat plate solar heat collector with an attached reflecting panel for the collection  storage  and radiation of solar heat, 4149520, April 17  1979, 
pat1_1326, Solar heating apparatus and mounting therefor, 4148296, April 10  1979, 
pat1_1327, Solar energy collector, 4147561, April 3  1979, 
pat1_1328, Sun-tracking control system for solar collector, 4146785, March 27  1979, 
pat1_1329, Solar heat exchange panel, 4146012, March 27  1979, 
pat1_132, Dish reflector concentrator structure, 8166966, May 1  2012, 
pat1_1330, System and structure for conditioning air, 4144999, March 20  1979, 
pat1_1331, Solar energy assembly, 4144095, March 13  1979, 
pat1_1332, Solar heat trap with double fluid circuits, 4143643, March 13  1979, 
pat1_1333, Solar energy collector, 4143641, March 13  1979, 
pat1_1334, Method of and apparatus for collecting solar radiation utilizing variable curvature cylindrical reflectors, 4141626, February 27  1979, 
pat1_1335, Method of producing a PN junction type solar battery, 4140610, February 20  1979, 
pat1_1337, Multimode solar energy collector and process, 4136673, January 30  1979, 
pat1_1338, Solar energy conversion system, 4135489, January 23  1979, 
pat1_1339, Thermal energy transformer, 4135367, January 23  1979, 
pat1_133, Junction box and conductor strip connection device thereof, 8162677, April 24  2012, 
pat1_1340, Structural support for solar cell array, 4132570, January 2  1979, 
pat1_1341, Tracking system for solar energy collector, 4132223, January 2  1979, 
pat1_1342, Solar air heat collector, 4132217, January 2  1979, 
pat1_1343, Protective device particularly for welding and cutting work, 4130903, December 26  1978, 
pat1_1344, Solar collector for heating a fluid, 4130108, December 19  1978, 
pat1_1345, Method and apparatus for reactive sputtering, 4128466, December 5  1978, 
pat1_1346, Heat collecting and transferring apparatus and systems adapted for use with solar energy, 4127103, November 28  1978, 
pat1_1347, Solar hot water booster and exchanger for use therein, 4126122, November 21  1978, 
pat1_1348, Kinematic synchronous solar heliostat, 4122827, October 31  1978, 
pat1_1349, Stable solar power source for portable electrical devices, 4122396, October 24  1978, 
pat1_134, LED lamp assembly, 8157406, April 17  2012, 
pat1_1350, Solar heating unit, 4121565, October 24  1978, 
pat1_1351, Solar collector, 4120288, October 17  1978, 
pat1_1352, Combined high density solar panels and vertical wind turbines, 4119863, October 10  1978, 
pat1_1353, Trough reflector, 4119365, October 10  1978, 
pat1_1354, Solar collector, 4117828, October 3  1978, 
pat1_1355, Unitary solar collector, 4114597, September 19  1978, 
pat1_1356, Solar heating system, 4114593, September 19  1978, 
pat1_1357, Solar energy collector, 4112922, September 12  1978, 
pat1_1358, Method and system for utilizing a flexible tubing solar collector, 4112921, September 12  1978, 
pat1_1359, Window solar heating unit, 4112919, September 12  1978, 
pat1_135, Measurement of undisturbed radon ground surface flux using a passive radon surface flux monitor, 8153959, April 10  2012, 
pat1_1360, Combined solar radiation collector and thermal energy storage device, 4111189, September 5  1978, 
pat1_1361, Extruded metal solar collector roofing shingle, 4111188, September 5  1978, 
pat1_1362, Modular solar radiation collector, 4111187, September 5  1978, 
pat1_1363, Sun tracking solar energy collector, 4111184, September 5  1978, 
pat1_1364, Solar collector, 4108159, August 22  1978, 
pat1_1365, Solar energy reflecting system, 4106485, August 15  1978, 
pat1_1366, Solar collectors, 4103675, August 1  1978, 
pat1_1367, Modular solar collector system, 4103674, August 1  1978, 
pat1_1368, Solar collector, 4103672, August 1  1978, 
pat1_1369, System for collecting solar energy, 4102329, July 25  1978, 
pat1_136, Roofing system and method, 8153700, April 10  2012, 
pat1_1370, Central receiver solar collector using mechanically linked mirrors, 4102326, July 25  1978, 
pat1_1371, Sundial, 4102054, July 25  1978, 
pat1_1372, Solar energy collection apparatus, 4091796, May 30  1978, 
pat1_1373, Solar powered spinning apparatus, 4090715, May 23  1978, 
pat1_1374, Solar tracking device, 4089323, May 16  1978, 
pat1_1375, Solar heat collecting units, 4088117, May 9  1978, 
pat1_1376, Devices and methods for converting heat energy to mechanical energy, 4087971, May 9  1978, 
pat1_1377, Perforated heat transfer sheet, 4086908, May 2  1978, 
pat1_1378, Solar-radiation collection apparatus with tracking circuitry, 4086485, April 25  1978, 
pat1_1379, Solar heater unit, 4084575, April 18  1978, 
pat1_137, Solar panel mounting structure, 8151789, April 10  2012, 
pat1_1380, Solar Collector and drive circuitry control means, 4082947, April 4  1978, 
pat1_1381, Seasonably adjustable window, 4081934, April 4  1978, 
pat1_1382, Solar cell electric and heating system, 4080221, March 21  1978, 
pat1_1383, Solar ladder, 4079725, March 21  1978, 
pat1_1384, Low-loss solar heat collectors, 4078545, March 14  1978, 
pat1_1385, Solar energy heat collector, 4077393, March 7  1978, 
pat1_1386, Novel solar collector, 4077392, March 7  1978, 
pat1_1387, Direct conversion of solar energy to mechanical energy, 4075847, February 28  1978, 
pat1_1388, Vacuum solar collectors, 4069810, January 24  1978, 
pat1_1389, Sealed turbine engine, 4069673, January 24  1978, 
pat1_138, Solar device control apparatus with device interchangeability, 8151787, April 10  2012, 
pat1_1390, Solar heated shelter with moveable secondary roof, 4067347, January 10  1978, 
pat1_1391, Device for the transmission of solar energy to a liquid medium, 4066063, January 3  1978, 
pat1_1392, Solar energy collectors, 4063544, December 20  1977, 
pat1_1393, Solar collector unit, 4062346, December 13  1977, 
pat1_1394, Solar heater apparatus, 4060072, November 29  1977, 
pat1_1395, Air conditioned shelter, 4059969, November 29  1977, 
pat1_1396, Solar collector, 4058111, November 15  1977, 
pat1_1397, Panel for solar energy cells, 4056405, November 1  1977, 
pat1_1398, Reinforced structural panel with integral solar energy collecting array and method of producing and assembling same, 4051833, October 4  1977, 
pat1_1399, Solar heated building structure, 4049195, September 20  1977, 
pat1_139, Stirling engine systems  apparatus and methods, 8151568, April 10  2012, 
pat1_13, Traffic barrier deployment system, 8500360, August 6  2013, 
pat1_1400, Three-dimensional tracking solar energy concentrator and method for making same, 4046462, September 6  1977, 
pat1_1401, Rechargeable flashlight assembly, 4045663, August 30  1977, 
pat1_1402, Pollution-free heating system, 4040566, August 9  1977, 
pat1_1403, Solar energy collector apparatus, 4038972, August 2  1977, 
pat1_1404, Solar heat boiler, 4034737, July 12  1977, 
pat1_1405, Solar heating method and apparatus, 4034736, July 12  1977, 
pat1_1406, Solar energy collector module system, 4033327, July 5  1977, 
pat1_1407, Solar energy conversion plant, 4031879, June 28  1977, 
pat1_1408, Solar power system, 4030890, June 21  1977, 
pat1_1409, Solar energy collector, 4027653, June 7  1977, 
pat1_140, Vertically integrated greenhouse, 8151518, April 10  2012, 
pat1_1410, Solar energy reflector-collector, 4024852, May 24  1977, 
pat1_1411, Solar heating device, 4023555, May 17  1977, 
pat1_1412, High density-third dimension geometry solar panels, 4023368, May 17  1977, 
pat1_1413, Heat actuable directing device, 4022185, May 10  1977, 
pat1_1414, Lateral lens arrangement for solar energy conversion devices, 4022184, May 10  1977, 
pat1_1415, Solar energy converter and elongated Fresnel lens element, 4011857, March 15  1977, 
pat1_1416, Spacecraft structure, 4009851, March 1  1977, 
pat1_1417, Apparatus for air conditioning employing variable terminal box, 4008756, February 22  1977, 
pat1_1418, Arrangement for utilizing solar energy for heating buildings, 4006856, February 8  1977, 
pat1_1419, Radiant energy collection, 4003638, January 18  1977, 
pat1_141, Method and apparatus for implementing a consumer-configurable modular electrical system, 8145327, March 27  2012, 
pat1_1420, Solar panel construction, 4003363, January 18  1977, 
pat1_1421, Solar energy absorber plate having a breather tube, 3999536, December 28  1976, 
pat1_1422, Solar energy converter, 3999389, December 28  1976, 
pat1_1423, Method of fabricating a photovoltaic device, 3999283, December 28  1976, 
pat1_1424, System for collecting and utilizing solar energy, 3998206, December 21  1976, 
pat1_1425, Solar heating apparatus, 3996917, December 14  1976, 
pat1_1426, Solar heat collector, 3995614, December 7  1976, 
pat1_1427, Solar heat collector unit, 3995613, December 7  1976, 
pat1_1428, Roof-lens solar collector, 3991741, November 16  1976, 
pat1_1429, Solar heat collector having a vapor barrier seal and method of making same, 3990431, November 9  1976, 
pat1_142, Solar battery module device and method of installing the same, 8141306, March 27  2012, 
pat1_1430, Solar energy collector system, 3990430, November 9  1976, 
pat1_1431, Apparatus for converting solar energy into mechanical energy, 3989417, November 2  1976, 
pat1_1432, Solar heating panel, 3987783, October 26  1976, 
pat1_1433, Solar battery maintainer, 3982963, September 28  1976, 
pat1_1434, Solar heat collector, 3981293, September 21  1976, 
pat1_1435, Solar heat collector, 3974822, August 17  1976, 
pat1_1436, Diffusion welded solar cell array, 3973996, August 10  1976, 
pat1_1437, Solar energy collector with moving belt absorber, 3972316, August 3  1976, 
pat1_1438, Apparatus responsive to solar energy for producing power, 3968652, July 13  1976, 
pat1_1439, Solar radiation collector and concentrator, 3964464, June 22  1976, 
pat1_143, Junction box and conductor strip connection device thereof, 8137115, March 20  2012, 
pat1_1440, Method of planar mounting of silicon solar cells, 3964155, June 22  1976, 
pat1_1441, Lightweight reflective panels for solar-thermal power plants and methods of forming such panels, 3959056, May 25  1976, 
pat1_1442, Solar heat collector, 3954097, May 4  1976, 
pat1_1443, Solar water heater, 3952725, April 27  1976, 
pat1_1444, Solar heat-collector device, 3948247, April 6  1976, 
pat1_1445, Solar collector system, 3937208, February 10  1976, 
pat1_144, System for assisting solar power generation, 8136783, March 20  2012, 
pat1_145, Solar panel and equipment mounting apparatus for roofs, 8136311, March 20  2012, 
pat1_146, Photovoltaic solar panel mounting system, 8136310, March 20  2012, 
pat1_147, Revolving solar powered flower pot saucer, 8132359, March 13  2012, 
pat1_148, Transportable decontamination unit and decontamination process, 8128888, March 6  2012, 
pat1_149, Security mailbox system, 8123113, February 28  2012, 
pat1_150, Roof mounted solar collector devices with connection piping movable from protected to installation position, 8122879, February 28  2012, 
pat1_151, Portable advertising platform, 8122628, February 28  2012, 
pat1_152, High efficiency counterbalanced dual axis solar tracking array frame system, 8119963, February 21  2012, 
pat1_153, Control signal generation of a solar panel orientation system with interference reduction using an infrared filter, 8119962, February 21  2012, 
pat1_154, Photovoltaic soundproof wall, 8118135, February 21  2012, 
pat1_155, Solar module connector and method of use, 8113890, February 14  2012, 
pat1_156, T-post and other mounting systems and accessories, 8113473, February 14  2012, 
pat1_157, One-way see-through illumination system, 8100575, January 24  2012, 
pat1_158, Solar power augmented heat shield systems, 8100341, January 24  2012, 
pat1_159, Upright rotatable product carrousel dispensing device, 8100291, January 24  2012, 
pat1_15, In-ground solar trough, 8490620, July 23  2013, 
pat1_160, Solar roof tracker, 8100122, January 24  2012, 
pat1_161, Assemblies for constructing solar panel mounting systems, 8099922, January 24  2012, 
pat1_162, Panel box, 8097818, January 17  2012, 
pat1_163, Solar light collector assembly having a clamp arrangement for attaching a mirror to a frame truss, 8091544, January 10  2012, 
pat1_164, Illuminated directional wind speed indicator, 8091420, January 10  2012, 
pat1_165, Light concentrating modules  systems and methods, 8088994, January 3  2012, 
pat1_166, LED light having projector with focus adjustment, 8083377, December 27  2011, 
pat1_167, Airborne emitter/receiver arrays  and associated systems and methods, 8081141, December 20  2011, 
pat1_168, Container track for container transport, 8074787, December 13  2011, 
pat1_169, Method for manufacturing a solar cell module available for the sunroof of a vehicle, 8070902, December 6  2011, 
pat1_16, Semiconductor device and method for manufacturing the same, 8481370, July 9  2013, 
pat1_170, Solar LED lamp, 8070311, December 6  2011, 
pat1_171, Sensor housing with solar module for field device, 8069720, December 6  2011, 
pat1_172, System for mounting, 8065838, November 29  2011, 
pat1_173, Concentrator solar photovoltaic array with compact tailored imaging power units, 8063300, November 22  2011, 
pat1_174, Berthing system and structure for use therein, 8056491, November 15  2011, 
pat1_175, Auto-irrigating case, 8056284, November 15  2011, 
pat1_176, Solar energy collection devices, 8053662, November 8  2011, 
pat1_177, Vehicular temperature control device, 8051904, November 8  2011, 
pat1_178, Solar powered kayak outrigger, 8047153, November 1  2011, 
pat1_179, Tactical solar power system, 8046961, November 1  2011, 
pat1_17, Fixture for attaching a profile rail to another component, 8480330, July 9  2013, 
pat1_180, Deck mounting for solar chlorine generator, D647388, October 25  2011, 
pat1_181, Solar servo control tracking device, 8042534, October 25  2011, 
pat1_182, System and method for controlling hydronic systems having multiple sources and multiple loads, 8041462, October 18  2011, 
pat1_183, Mount for an electronic device, 8041029, October 18  2011, 
pat1_184, Method of assembling integrated circuit components, 8039360, October 18  2011, 
pat1_185, Demounting of inverted metamorphic multijunction solar cells, 8039291, October 18  2011, 
pat1_186, Connection and junction box for a solar module, 8033859, October 11  2011, 
pat1_187, Self-contained apparatuses for hanging  holding  rotating  or watering plants using solar power for plant maintenance, 8033050, October 11  2011, 
pat1_188, Solar-powered light pole and LED light fixture, 8029154, October 4  2011, 
pat1_189, Passive solar wire screens for buildings, 8028691, October 4  2011, 
pat1_18, Solar cell module and solar cell array, 8479458, July 9  2013, 
pat1_190, Extruded rail set used for mounting solar panels, D645981, September 27  2011, 
pat1_191, Wave energy converter, 8026620, September 27  2011, 
pat1_192, Portable power and utility system, 8013567, September 6  2011, 
pat1_193, Metering pump power source, 8008806, August 30  2011, 
pat1_194, Reflector assembly for energy concentrators, 8006689, August 30  2011, 
pat1_195, Electrical connector assembly, 8002593, August 23  2011, 
pat1_196, Road marker, 7993073, August 9  2011, 
pat1_197, Spike for outdoor lighting fixture, 7993040, August 9  2011, 
pat1_198, Portable self regenerating power system, 7989980, August 2  2011, 
pat1_199, Fluid coupled heat to motion converter (a form of heat engine) FCHTMC, 7980080, July 19  2011, 
pat1_19, Ice buildup inhibitor, 8476558, July 2  2013, 
pat1_1, Solar tracking, 8522773, September 3  2013, 
pat1_200, Lead frame thermoplastic solar cell receiver, 7977777, July 12  2011, 
pat1_201, Solar powered rechargeable street light with tamper resistant networkable system, 7976180, July 12  2011, 
pat1_202, Integrated mounting system for communication and surveillance infrastructures, 7974079, July 5  2011, 
pat1_203, Photovoltaic solar panel mounting system, 7971398, July 5  2011, 
pat1_204, Solar energy collection system, 7968791, June 28  2011, 
pat1_205, Owl with intermittent powered movement, 7966963, June 28  2011, 
pat1_206, Solar battery module  installation structure for solar battery module  roof with power generating function of the installation structure  and method of installing solar battery module, 7964786, June 21  2011, 
pat1_207, String interconnection and fabrication of inverted metamorphic multijunction solar cells, 7960201, June 14  2011, 
pat1_208, Solar cell module retaining structure  frame for solar cell module  and holding member for solar cell module, 7956280, June 7  2011, 
pat1_209, Systems and methods for solar distillation, 7955477, June 7  2011, 
pat1_20, Method for fabricating solar cell comprising condenser lens and photoelectric conversion element, 8476098, July 2  2013, 
pat1_210, Decorative reflective spinning device, 7954264, June 7  2011, 
pat1_211, Integral powered wing aircraft, 7950603, May 31  2011, 
pat1_212, Carrier for a solar energy reflector element, 7950386, May 31  2011, 
pat1_213, Extruded rail set used for mounting solar panels on slightly slanted roofs, D638554, May 24  2011, 
pat1_214, Vehicle activity module, 7949541, May 24  2011, 
pat1_215, Flashing stern light for boats, 7946741, May 24  2011, 
pat1_216, Portable surface plasmon resonance biosensor, 7943092, May 17  2011, 
pat1_217, Connection and junction box for a solar module, 7931488, April 26  2011, 
pat1_218, Solar powered lighting for railing systems, 7931385, April 26  2011, 
pat1_219, Terminal box for a solar cell panel, 7928315, April 19  2011, 
pat1_21, Self-cleaning submerged instrumentation, 8473262, June 25  2013, 
pat1_220, Hot compressed gas vehicle, 7926610, April 19  2011, 
pat1_221, System and method for anchoring solar panels to a flat surface, 7921843, April 12  2011, 
pat1_222, Solar powered internally illuminated billboard, 7912590, March 22  2011, 
pat1_223, Solar sensor including first and additional modulators, 7906751, March 15  2011, 
pat1_224, Light bar and method for making, 7905640, March 15  2011, 
pat1_225, Traffic safety cone incorporating a flashing light module, 7905622, March 15  2011, 
pat1_226, Piggyback equipment panel payload arrangement  a device for and method of attaching a hosted secondary piggyback payload and adapter to be used for a piggyback secondary payload arrangement for launching the piggyback equipment panel secondary, 7905453, March 15  2011, 
pat1_227, Buss bar strip, 7902460, March 8  2011, 
pat1_228, Extra electric energy for day-night cycle solar aircraft, 7898789, March 1  2011, 
pat1_229, Integrated thermal and photovoltaic solar collector and method for operation and mounting an array of solar collectors, 7896000, March 1  2011, 
pat1_22, Two-stage solar concentrating system, 8471187, June 25  2013, 
pat1_230, Modular shade system with solar tracking panels, 7888587, February 15  2011, 
pat1_231, Solar-powered sun tracker, 7884308, February 8  2011, 
pat1_232, Connecting box of a solar panel with a cooling structure, 7880098, February 1  2011, 
pat1_233, Latching solar concentrator pivoted mirrors during off-power period, 7878667, February 1  2011, 
pat1_234, Solar powered irrigation machine, 7878429, February 1  2011, 
pat1_235, Warning light, 7872592, January 18  2011, 
pat1_236, Planar solar concentrator power module, 7872192, January 18  2011, 
pat1_237, Parabolic trough or dish reflector for use in concentrating solar power apparatus and method of making same, 7871664, January 18  2011, 
pat1_238, Solar powered fan, 7866958, January 11  2011, 
pat1_239, Fresnel solar concentrator array with centered universal pivots, 7866836, January 11  2011, 
pat1_23, Solar array support structure, 8468755, June 25  2013, 
pat1_240, Mounting structure of solar cell module, 7866099, January 11  2011, 
pat1_241, Vertical shaft type windmill with arcuate hook shaped vane blades, 7863765, January 4  2011, 
pat1_242, Electrical connector for a solar module assembly, 7862383, January 4  2011, 
pat1_243, Skyline imaging system for solar access determination, 7861422, January 4  2011, 
pat1_244, Continuous circuit overlay solar shingles, 7858874, December 28  2010, 
pat1_245, Mounting assembly for arrays and other surface-mounted equipment, 7857269, December 28  2010, 
pat1_246, Rack assembly for mounting solar modules, 7856769, December 28  2010, 
pat1_247, Passively cooled solar concentrating photovoltaic device, 7851693, December 14  2010, 
